{
  "task_id":"B11.2","agent_id":"codex-b11-green-01","claimed_at":"2026-07-01T04:52:36Z","active_plan_hash":"sha256:d195328a8b81fba72c1378e49f379bdd145e35b6793e0214e1ad91f20a2e29e6",
  "allowed_files":["tests/green/test_b11_2_aliases.py",".agent/claims/B11.2.codex-b11-green-01.json",".agent/state.log","docs/active/receipts/B11.2.md"],
  "forbidden_files":["SOUL.md","distribution.yaml","plugins/**","Hermes source","core behavior","live integrations","real learner data"],
  "completed_at":"2026-07-01T04:54:57Z","receipt":"docs/active/receipts/B11.2.md","status":"DONE"
}
