{
  "task_id": "C3.2",
  "agent_id": "codex-production-build-01",
  "claimed_at": "2026-06-29T23:59:53Z",
  "active_plan_hash": "sha256:bd1696ed859354f337118a697b6e7b548b1af72b26da52017e220c7ee1c88543",
  "allowed_files": [
    ".agent/claims/C3.2.codex-production-build-01.json",
    ".agent/state.log",
    "docs/active/contracts/SMC_CONTRACT.md",
    "docs/active/receipts/C3.2.md"
  ],
  "forbidden_files": [
    "schemas/**",
    "templates/**",
    "skills/**",
    "plugins/**"
  ],
  "completed_at": "2026-06-30T00:01:32Z",
  "receipt": "docs/active/receipts/C3.2.md",
  "status": "DONE"
}
