{
  "task_id":"F12.3","agent_id":"codex-f12-final-01","claimed_at":"2026-07-01T11:35:49Z","active_plan_hash":"sha256:d195328a8b81fba72c1378e49f379bdd145e35b6793e0214e1ad91f20a2e29e6",
  "allowed_files":["docs/active/BUILD_LEDGER.md","docs/active/learning_cards.md","docs/active/POST_RELEASE_TASKS.md","docs/active/FINAL_RECONCILIATION.md","docs/active/HERMES_COMPATIBILITY_MATRIX.md","docs/active/READINESS_REPORT.md","docs/active/authority.json","docs/active/receipts/F12.3.md",".agent/claims/F12.3.codex-f12-final-01.json",".agent/state.log"],
  "forbidden_files":["Hermes source","product implementation","live integrations","real learner data","Phase 10"],
  "completed_at":"2026-07-01T11:36:51Z","receipt":"docs/active/receipts/F12.3.md","status":"DONE"
}
