{
  "task_id":"U8.7","agent_id":"codex-u8-green-01","claimed_at":"2026-06-30T20:12:04Z","active_plan_hash":"sha256:d195328a8b81fba72c1378e49f379bdd145e35b6793e0214e1ad91f20a2e29e6",
  "allowed_files":["plugins/hermes-thrice-great/**","tests/green/**","tests/red/t4_9/**","fixtures/red/t4_9/**",".agent/claims/U8.7.codex-u8-green-01.json",".agent/state.log","docs/active/receipts/U8.7.md"],
  "forbidden_files":["Hermes source","live integrations","real learner data"],
  "completed_at":"2026-06-30T20:16:46Z","receipt":"docs/active/receipts/U8.7.md","status":"DONE"
}
