{
  "task_id":"E9.2","agent_id":"codex-e9-green-01","claimed_at":"2026-07-01T04:31:08Z","active_plan_hash":"sha256:d195328a8b81fba72c1378e49f379bdd145e35b6793e0214e1ad91f20a2e29e6",
  "allowed_files":["plugins/hermes-thrice-great/**","templates/**","tests/green/test_e9_2_orchestrator.py","tests/red/t4_10/**","fixtures/red/t4_10/**",".agent/claims/E9.2.codex-e9-green-01.json",".agent/state.log","docs/active/receipts/E9.2.md"],
  "forbidden_files":["Hermes source","live integrations","real learner data"],
  "completed_at":"2026-07-01T04:33:06Z","receipt":"docs/active/receipts/E9.2.md","status":"DONE"
}
