{
  "task_id": "H1.4",
  "agent_id": "codex-bootstrap-autopilot-01",
  "claimed_at": "2026-06-29T23:33:28Z",
  "active_plan_hash": "sha256:bd1696ed859354f337118a697b6e7b548b1af72b26da52017e220c7ee1c88543",
  "allowed_files": [
    ".agent/claims/H1.4.codex-bootstrap-autopilot-01.json",
    ".agent/state.log",
    "docs/active/recon/**",
    "docs/active/receipts/H1.4.md",
    "scripts/build_profile_staging.py",
    "tests/governance/test_profile_staging_builder.py",
    "tmp/h1.4-probe/**"
  ],
  "forbidden_files": [
    "C:/Users/alani/AppData/Local/hermes/hermes-agent/**",
    "plugins/**",
    "profiles/**",
    "schemas/**",
    "skills/**"
  ],
  "completed_at": "2026-06-29T23:36:15Z",
  "receipt": "docs/active/receipts/H1.4.md",
  "status": "DONE"
}
