{
  "task_id": "A2.7",
  "agent_id": "codex-bootstrap-autopilot-01",
  "claimed_at": "2026-06-29T23:47:54Z",
  "active_plan_hash": "sha256:bd1696ed859354f337118a697b6e7b548b1af72b26da52017e220c7ee1c88543",
  "allowed_files": [
    ".agent/claims/A2.7.codex-bootstrap-autopilot-01.json",
    ".agent/state.log",
    "docs/active/authority.json",
    "docs/active/ARCHIVE_HYGIENE_CHECK.md",
    "docs/active/BUILD_LEDGER.md",
    "docs/active/BOOTSTRAP_PROTOCOL.md",
    "docs/active/ROOT_DOC_CLASSIFICATION.md",
    "docs/active/READINESS_REPORT.md",
    "docs/active/receipts/A2.7.md"
  ],
  "forbidden_files": [
    "README.md",
    "INSTALL.md",
    "scripts/**",
    "tests/**",
    "plugins/**",
    "profiles/**",
    "schemas/**",
    "skills/**"
  ],
  "completed_at": "2026-06-29T23:49:30Z",
  "receipt": "docs/active/receipts/A2.7.md",
  "status": "DONE"
}
