{
  "task_id": "A2.6",
  "agent_id": "codex-bootstrap-autopilot-01",
  "claimed_at": "2026-06-29T23:45:35Z",
  "active_plan_hash": "sha256:bd1696ed859354f337118a697b6e7b548b1af72b26da52017e220c7ee1c88543",
  "allowed_files": [
    ".agent/claims/A2.6.codex-bootstrap-autopilot-01.json",
    ".agent/state.log",
    ".agent/claim.schema.json",
    "scripts/check_claim_state.py",
    "docs/active/receipts/A2.6.md"
  ],
  "forbidden_files": [
    "tests/governance/**",
    "plugins/**",
    "profiles/**",
    "schemas/**",
    "skills/**"
  ],
  "completed_at": "2026-06-29T23:47:05Z",
  "receipt": "docs/active/receipts/A2.6.md",
  "status": "DONE"
}
