{
  "task_id": "T0.2",
  "agent_id": "codex-bootstrap-autopilot-01",
  "claimed_at": "2026-06-29T21:20:42Z",
  "active_plan_hash": "sha256:6a8e1fe187010db2ab6652069758170090e8c7f7069bb3c1e935980e2c3a8564",
  "allowed_files": [
    ".agent/claims/T0.2.codex-bootstrap-autopilot-01.json",
    ".agent/state.log",
    "docs/active/TOPOLOGY_DECISION.md",
    "docs/active/architecture.mmd",
    "docs/active/receipts/T0.2.md",
    "docs/active/authority.json"
  ],
  "forbidden_files": [
    "docs/archive/**",
    "plugins/**",
    "profiles/**",
    "schemas/**",
    "skills/**"
  ],
  "completed_at": "2026-06-29T21:21:20Z",
  "receipt": "docs/active/receipts/T0.2.md",
  "status": "DONE"
}
