{
  "task_id": "C3.6A",
  "agent_id": "codex-c3-ledger-amend-01",
  "claimed_at": "2026-06-30T15:31:42Z",
  "active_plan_hash": "sha256:d195328a8b81fba72c1378e49f379bdd145e35b6793e0214e1ad91f20a2e29e6",
  "allowed_files": [
    "docs/active/PROJECT_TASKS.md",
    "docs/active/contracts/BRIEF_LEDGER_CONTRACT.md",
    "docs/active/contracts/LOCK_AUDIT.md",
    "docs/active/BUILD_LEDGER.md",
    "docs/active/receipts/C3.6A.md",
    ".agent/claims/**",
    ".agent/state.log",
    "docs/active/authority.json"
  ],
  "forbidden_files": [
    "tests/**",
    "schemas/**",
    "plugins/**",
    "skills/**",
    "production runtime",
    "Hermes source",
    "live integrations",
    "real learner data"
  ],
  "completed_at": "2026-06-30T15:35:02Z",
  "receipt": "docs/active/receipts/C3.6A.md",
  "status": "DONE"
}
