{
  "task_id": "R4.0",
  "agent_id": "codex-r4-readiness-01",
  "claimed_at": "2026-06-30T07:14:48Z",
  "active_plan_hash": "sha256:d195328a8b81fba72c1378e49f379bdd145e35b6793e0214e1ad91f20a2e29e6",
  "allowed_files": [
    ".agent/claims/R4.0.codex-r4-readiness-01.json",
    ".agent/state.log",
    "tests/canary/**",
    "scripts/run_host_canary.py",
    "docs/active/receipts/R4.0.md"
  ],
  "forbidden_files": [
    "schemas/**",
    "skills/**",
    "plugins/**",
    "Hermes source",
    "live integrations"
  ],
  "completed_at": "2026-06-30T07:18:25Z",
  "receipt": "docs/active/receipts/R4.0.md",
  "status": "DONE"
}
