{
  "task_id": "R4.2",
  "agent_id": "codex-r4-readiness-01",
  "claimed_at": "2026-06-30T07:24:52Z",
  "active_plan_hash": "sha256:d195328a8b81fba72c1378e49f379bdd145e35b6793e0214e1ad91f20a2e29e6",
  "allowed_files": [
    ".agent/claims/R4.2.codex-r4-readiness-01.json",
    ".agent/state.log",
    "docs/active/SECURITY_BASELINE.md",
    "tests/canary/test_hermes_restrictions.py",
    "scripts/verify_hermes_restrictions.py",
    "docs/active/authority.json",
    "docs/active/receipts/R4.2.md"
  ],
  "forbidden_files": [
    "schemas/**",
    "skills/**",
    "plugins/**",
    "Hermes source",
    "live integrations"
  ],
  "completed_at": "2026-06-30T07:28:32Z",
  "receipt": "docs/active/receipts/R4.2.md",
  "status": "DONE"
}
