{
  "task_id": "H1.3",
  "agent_id": "codex-bootstrap-autopilot-01",
  "claimed_at": "2026-06-29T21:31:44Z",
  "active_plan_hash": "sha256:6a8e1fe187010db2ab6652069758170090e8c7f7069bb3c1e935980e2c3a8564",
  "allowed_files": [
    ".agent/claims/H1.3.codex-bootstrap-autopilot-01.json",
    ".agent/state.log",
    "docs/active/recon/**",
    "docs/active/receipts/H1.3.md",
    "tmp/h1.3-probe/**"
  ],
  "forbidden_files": [
    "C:/Users/alani/AppData/Local/hermes/hermes-agent/**",
    "plugins/**",
    "profiles/**",
    "schemas/**",
    "skills/**"
  ],
  "completed_at": "2026-06-29T21:33:12Z",
  "receipt": "docs/active/receipts/H1.3.md",
  "status": "DONE"
}
