{
  "task_id":"P6.2","agent_id":"codex-p6-green-01","claimed_at":"2026-06-30T18:55:44Z","active_plan_hash":"sha256:d195328a8b81fba72c1378e49f379bdd145e35b6793e0214e1ad91f20a2e29e6",
  "allowed_files":["plugins/hermes-thrice-great/**","distribution.yaml","tests/red/t4_8/**","dist/**",".agent/claims/P6.2.codex-p6-green-01.json",".agent/state.log","docs/active/receipts/P6.2.md"],
  "forbidden_files":["schemas/**","skills/**","Hermes source","live integrations","real learner data"],
  "completed_at":"2026-06-30T18:56:46Z","receipt":"docs/active/receipts/P6.2.md","status":"DONE"
}
