{
  "task_id": "R4.1",
  "agent_id": "codex-r4-readiness-01",
  "claimed_at": "2026-06-30T07:19:04Z",
  "active_plan_hash": "sha256:d195328a8b81fba72c1378e49f379bdd145e35b6793e0214e1ad91f20a2e29e6",
  "allowed_files": [
    ".agent/claims/R4.1.codex-r4-readiness-01.json",
    ".agent/state.log",
    "pyproject.toml",
    "requirements-dev.lock",
    "requirements-runtime.lock",
    "tests/canary/test_dependency_locks.py",
    "docs/active/HERMES_COMPATIBILITY_MATRIX.md",
    "docs/active/authority.json",
    "docs/active/receipts/R4.1.md"
  ],
  "forbidden_files": [
    "schemas/**",
    "skills/**",
    "plugins/**",
    "Hermes source",
    "live integrations"
  ],
  "completed_at": "2026-06-30T07:22:48Z",
  "receipt": "docs/active/receipts/R4.1.md",
  "status": "DONE"
}
