{
  "task_id": "C3.1",
  "agent_id": "codex-production-build-01",
  "claimed_at": "2026-06-29T23:55:06Z",
  "active_plan_hash": "sha256:bd1696ed859354f337118a697b6e7b548b1af72b26da52017e220c7ee1c88543",
  "allowed_files": [
    ".agent/claims/C3.1.codex-production-build-01.json",
    ".agent/state.log",
    "docs/active/contracts/**",
    "docs/active/receipts/C3.1.md"
  ],
  "forbidden_files": [
    "C:/Users/alani/AppData/Local/hermes/**",
    "schemas/**",
    "skills/**",
    "plugins/**",
    "profiles/**"
  ],
  "completed_at": "2026-06-29T23:59:02Z",
  "receipt": "docs/active/receipts/C3.1.md",
  "status": "DONE"
}
