{
  "task_id":"F12.2","agent_id":"codex-f12-final-01","claimed_at":"2026-07-01T11:29:19Z","active_plan_hash":"sha256:d195328a8b81fba72c1378e49f379bdd145e35b6793e0214e1ad91f20a2e29e6",
  "allowed_files":["docs/active/FINAL_ACCEPTANCE_REPORT.md","docs/active/RISK_REPORT.md","docs/active/HERMES_COMPATIBILITY_MATRIX.md","docs/active/READINESS_REPORT.md","docs/active/authority.json","docs/active/receipts/F12.2.md",".agent/claims/F12.2.codex-f12-final-01.json",".agent/state.log"],
  "forbidden_files":["Hermes source","product implementation","tests","live integrations","real learner data","Phase 10"],
  "completed_at":"2026-07-01T11:35:24Z","receipt":"docs/active/receipts/F12.2.md","status":"DONE"
}
