{
  "task_id":"S5.1",
  "agent_id":"codex-s5-green-01",
  "claimed_at":"2026-06-30T16:10:20Z",
  "active_plan_hash":"sha256:d195328a8b81fba72c1378e49f379bdd145e35b6793e0214e1ad91f20a2e29e6",
  "allowed_files":["skills/**","tests/red/t4_7/**","fixtures/red/t4_7/**",".agent/claims/S5.1.codex-s5-green-01.json",".agent/state.log","docs/active/receipts/S5.1.md"],
  "forbidden_files":["schemas/**","plugins/**","distribution.yaml","SOUL.md","config.yaml","Hermes source","live integrations","real learner data"],
  "completed_at":"2026-06-30T16:11:58Z",
  "receipt":"docs/active/receipts/S5.1.md",
  "status":"DONE"
}
